### ISSUE TITLE
FTL DNS resolution freezes under rapid sequential SSH/rsync connections following event-driven client handling (#2922)

### ISSUE THREAD

**Issue by mapi68** [pi-hole/FTL#3050]
Versions
- Pi-hole: v6.4.3
- Web: v6.6
- FTL: v6.7

Platform
- OS and version: Raspberry Pi OS (Debian 13 trixie)
- Platform: Raspberry Pi (rasp0)

Expected behavior
FTL should smoothly handle rapid, short-lived network socket creations and kernel neighbor updates without stalling or dropping local DNS resolution capabilities.

Actual behavior / bug
When multiple rapid, sequential SSH/rsync connections are established to the Pi-hole host (rasp0), FTL enters a state where local DNS name resolution completely freezes or times out.
Reverting FTL back to v6.6.2 under the exact same hardware, OS, and workload completely eliminates the issue.

Steps to reproduce
- Update Pi-hole FTL to version v6.7 (which includes PR #2922).
- Execute rapid, repetitive rsync operations over SSH towards the Pi-hole host (rasp0).
- Simultaneously perform local DNS queries (e.g., dig @127.0.0.1 rasp0 or general LAN queries).
- Observe FTL DNS resolution freeze/timeout during or immediately after the burst of connections.

Debug Token
URL: https://tricorder.pi-hole.net/N8KovJu1/

Screenshots
N/A

Additional context
This issue appears to be directly related to PR #2922 (Re-resolve client groups event-driven, drop periodic recheck).
The newly introduced event-driven client group re-resolution triggers kernel neighbor table lookups (parse_neighbor_cache / find_mac) and interface binding updates on identity changes. When rapid SSH/rsync sessions open and close, the continuous churn in connection states (TIME_WAIT, kernel socket updates) appears to cause a lockup or race condition in FTL's event-driven cache invalidation routines, resulting in a thread stall or complete unresponsiveness for DNS queries.

**Comment by DL6ER** [comment]
Thanks for the bisect - that is the useful half of the report. The mechanism is not supported by the code, though.

Everything #2922 added is gated on an identity actually changing: the MAC path only fires when the kernel reports a MAC that differs from the one already on the client, and the name path only when the resolved name changed. A LAN peer reconnecting over SSH keeps both, so none of it runs. The interface path got cheaper, not more expensive - before #2922 a client alternating between two interfaces reloaded its groups on every query, because the new interface was never adopted. That is the bug the PR fixed.

v6.6.2 -> v6.7 is 462 commits, including a dnsmasq update that reworked the TCP path considerably. dnsmasq forks a child per TCP connection, so that is where I would look first.

To narrow it down, during a freeze:

- is `pihole-FTL` at 100% CPU, or idle? `top -b -n1 | head -20`
- does `dig @127.0.0.1 pi.hole` time out while `dig @9.9.9.9 pi.hole` answers?
- does `grep -i "CAP_SYS_NICE" /var/log/pihole/FTL.log` return anything?

The last one matters more than it looks: FTL renices itself to -10, and a downgrade rewrites the binary's file capabilities. If v6.6.2 came back with CAP_SYS_NICE and v6.7 did not, the version difference is not in the code. #2721 was that exact case.

**Comment by mapi68** [comment]
Thanks @DL6ER for the explanation regarding the updated TCP stack in dnsmasq.

To put everything into clear order, here is the exact sequence that causes the freeze on v6.7:

1. **Trigger:** Establishing rapid, consecutive network connections (such as SSH/rsync bursts) targeting the Pi-hole server by its hostname (`rasp0`).
2. **Behavior:** The **first** query for `rasp0` resolves correctly. However, the **second consecutive query sent in rapid succession** fails to hit/serve from the local cache and triggers a lookup loop.
3. **Consequence:** Under v6.7's updated TCP/fork handling, this sudden burst of un-cached requests causes FTL's DNS resolution service to stall completely.

**Update on local configuration:**
I tested explicitly setting `192.168.1.100 rasp0` in `/etc/hosts` (and removing `127.0.1.1`), but the issue persists on v6.7. Under v6.6.2, identical rapid queries for `rasp0` were handled smoothly without freezing the DNS service.

This confirms the issue is not caused by misconfigured loopback entries, but rather by FTL v6.7 failing to properly serve consecutive, rapid requests for its local hostname from cache, resulting in a thread/socket stall.

**Comment by 010011110** [comment]
a mechanism that fits both the bisect and the objection: #2922 looks like the amplifier here rather than the bug

v6.7 carries #2922 and it also still has #2978. the internal ptr resolver shares one udp socket for a whole sweep and does not correlate replies, so when a lookup times out the late reply is picked up by the next lookup and a client ends up with another host's name. as far as resolveClients() can tell that is a name change, so resolve.c:1044 clears found_group and the client's next dns query re-resolves its groups against gravity. every sweep, for as long as the lookups keep timing out

which is where the rsync burst comes in. dnsmasq busy forking per tcp connection is exactly what makes those internal ptr queries to 127.0.0.1 time out in the first place

that would also explain why going back to v6.6.2 stops it while the defect is still there: without #2922 a wrong name is cosmetic, with it a wrong name puts gravity work on the query path

@mapi68 worth a look from your side, with debug.resolver enabled: during a burst, does a client name flap between two of your lan hosts, or does rasp0's name turn up on the wrong ip in the client list. that would confirm or kill this quickly

#2979 landed the reply correlation in development yesterday, so v7 should not show this either way

**Comment by mapi68** [comment]
@010011110 I ran with `DEBUG_RESOLVER=true` on both versions and compared the logs directly.

**No hostname flapping / misassignment.** During the bursts on v6.7, client names do not flap between different LAN hosts, and `rasp0` never gets mapped to an incorrect IP in the client list. Same hosts always resolve to the same names (garage, portatile, eugenio, salotto-ma, a53, gbtrio4k). So this doesn't match the reply-correlation/wrong-name theory from #2978.

**Behavior difference between the two versions:**
v6.6.2 (started 18:36:24) runs a full synchronous batch lookup at startup, resolving all 23 clients consecutively in under a second:

```
2026-08-30 18:36:27.545 CEST [11635/T11818] DEBUG_RESOLVER: Trying to resolve 192.168.1.37
2026-08-30 18:36:27.547 CEST [11635/T11818] DEBUG_RESOLVER: Client 192.168.1.37 -> "eugenio" is new
2026-08-30 18:36:27.547 CEST [11635/T11818] DEBUG_RESOLVER: Trying to resolve 192.168.1.40
...
2026-08-30 18:36:27.585 CEST [11635/T11818] DEBUG_RESOLVER: 23 / 23 client host names resolved
```

v6.7 (started 18:39:18) switches to incremental/event-driven resolution, processing clients in small chunks over time and explicitly logging "Skipping client ... because it is not new" for already-known hosts:

```
2026-08-30 18:39:34.091 CEST [12103/T12112] DEBUG_RESOLVER: Client 192.168.1.68 -> "portatile" is new
2026-08-30 18:39:34.094 CEST [12103/T12112] DEBUG_RESOLVER: Client 192.168.1.37 -> "eugenio" is new
2026-08-30 18:39:34.094 CEST [12103/T12112] DEBUG_RESOLVER: 2 / 4 client host names resolved
2026-08-30 18:39:42.104 CEST [12103/T12112] DEBUG_RESOLVER: Skipping client 192.168.1.11 -> "garage" because it is not new
2026-08-30 18:39:42.107 CEST [12103/T12112] DEBUG_RESOLVER: Client 192.168.1.14 -> "salotto-ma" is new
2026-08-30 18:39:44.117 CEST [12103/T12112] DEBUG_RESOLVER: 1 / 6 client host names resolved
2026-08-30 18:41:21.216 CEST [12103/T12112] DEBUG_RESOLVER: Trying to resolve 192.168.1.21
2026-08-30 18:41:21.221 CEST [12103/T12112] DEBUG_RESOLVER: 1 / 7 client host names resolved
```

Note the gap between 18:39:44 and 18:41:21, almost two minutes for a single client, versus milliseconds for the same volume on 6.6.2.

More importantly, as soon as the burst hits on v6.7, local resolution fails system-wide, not just slowly. A plain `ping rasp0` returns:

```
$ ping rasp0
ping: rasp0: Name or service not known
```

So this isn't just the incremental resolver being slower to catch up, something in the event-driven path is causing local lookups to fail outright during the burst, rather than just lagging behind. Happy to capture a longer window through a full SSH/rsync burst with `ping`/`dig` running in parallel if that helps pin down exactly when resolution drops out.

**Comment by DL6ER** [comment]
@010011110 Confirmed: #2979 merged into `development` yesterday and adds exactly that correlation, so a late reply can no longer be read as the next answer. That is #2978, marked fixed for the next release.

@mapi68, please test it:

```
pihole checkout dev
```

Reproduce the rsync burst and tell me if the freeze persists. `development` currently carries two breaking changes - `dns.blockESNI` and the `flush/arp` API route are gone, and the `webserver.log` format changed - but nothing touches the databases, so `pihole checkout master` takes you straight back if you need it. If it still freezes, the PTR correlation was not the cause and I will look at the TCP fork path.

**Comment by mapi68** [comment]
@DL6ER Got a clean, concrete capture of the freeze this time from an unrelated deploy script that happens to hit `rasp0` with several sequential SSH connections.

CPU and `dig`/`ping` checked manually right after didn't show anything unusual (no high load, both `@127.0.0.1` and `@9.9.9.9` answered fine), but the deploy log below caught the failure window itself:

```
PHASE 5: Deploy (1 destination)

--- rasp0: root@rasp0:/home/[REDACTED]/[REDACTED] ---
1. SSH connection... (timeout: 10s)
   Connected successfully
4. Pre deploy commands... (timeout: 10s)
   $ systemctl stop [REDACTED].service
   Failed (exit 255): ssh: Could not resolve hostname rasp0: No address associated with hostname
4b. Backup target binary... (/home/[REDACTED]/[REDACTED])
   $ test -e '/home/[REDACTED]/[REDACTED]' && cp -a '/home/[REDACTED]/[REDACTED]' '/home/[REDACTED]/[REDACTED].bak'
   Backup failed (exit 255): ssh: Could not resolve hostname rasp0: No address associated with hostname -- continuing with deploy
5. Deploy: [REDACTED]-git11966@5905109e-default-rpi_aarch64-webif... (timeout: 60s)
   SCP failed, trying SFTP mode (-s)...
   SFTP failed, trying SCP protocol (-O)...
   Deploy failed: ssh: Could not resolve hostname rasp0: No address associated with hostname
lost connection
6. Post deploy commands... (timeout: 10s)
   $ systemctl start [REDACTED].service
   Failed (exit 255): ssh: Could not resolve hostname rasp0: No address associated with hostname
Done: rasp0
```

A few things worth pointing out:

- The **first** SSH connection in the sequence succeeds ("Connected successfully"). Every connection attempt right after that, within the same deploy run, fails client-side with `Could not resolve hostname rasp0: No address associated with hostname`, the exact symptom from the original report (`ping: rasp0: Name or service not known`).
- This confirms it's specifically the *sequence* of closely spaced connections that triggers it, not a general connectivity issue, a lone connection works fine.
- The freeze window lasted long enough to fail every subsequent step of this deploy (pre-deploy, backup, deploy, post-deploy), so it's not sub-second, this is on `development` with #2979 already in.
- The resolver log stayed completely silent during the failure, so whatever's happening isn't in the resolver thread, matches what I reported earlier.

For comparison, here is the exact same deploy script, same host, same steps, run against **v6.6.2**:

```
PHASE 5: Deploy (1 destination)

--- rasp0: root@rasp0:/home/[REDACTED]/[REDACTED] ---
1. SSH connection... (timeout: 10s)
   Connected successfully
4. Pre deploy commands... (timeout: 10s)
   $ systemctl stop [REDACTED].service
   OK (exit 0)
4b. Backup target binary... (/home/[REDACTED]/[REDACTED].bak)
   $ test -e '/home/[REDACTED]/[REDACTED]' && cp -a '/home/[REDACTED]/[REDACTED]' '/home/[REDACTED]/[REDACTED].bak'
   Saved: /home/[REDACTED]/[REDACTED].bak
5. Deploy: [REDACTED]-git11966@5905109e-default-rpi_aarch64-webif... (timeout: 60s)
   Deploy OK
6. Post deploy commands... (timeout: 10s)
   $ systemctl start [REDACTED].service
   OK (exit 0)
Done: rasp0
```

Every step passes cleanly, no resolution failures anywhere. Same script, same sequence of connections, only the FTL version differs.

So the freeze is confirmed still present on `development`, but this capture is more precise about where it lives: name resolution client-side, immediately following a burst of SSH connection attempts, with no corresponding CPU spike or resolver activity. Points toward the TCP fork/connection-handling path as you suspected rather than anything resolver-related.

Let me know if a specific `strace`/`tcpdump` capture on `rasp0` during the burst would help narrow it down further, happy to grab one.

**Comment by DL6ER** [comment]
Thanks for testing `development` - that rules out the PTR correlation, so #2978 was not it.

The error string in that log is worth a closer look, though, because it argues against a stall. `ssh: Could not resolve hostname rasp0: No address associated with hostname` is `EAI_NONAME`/`EAI_NODATA`: the resolver got an answer, it just carried no address. A server that has wedged or stopped replying gives `Temporary failure in name resolution` (`EAI_AGAIN`) instead, and that is the string I would expect from a freeze. So this capture looks more like an empty answer for `rasp0` than a dead resolution thread.

The other two observations do not narrow it. CPU and `dig` were checked after the window rather than during it, so idle CPU is not established for the failure itself, and `DEBUG_RESOLVER` only covers client name lookups, never forward queries - it staying silent is expected either way.

What would settle it, on the machine running the deploy script rather than on `rasp0`:

1. `tcpdump -i any -n port 53` across the burst. I want to see whether the query for `rasp0` is answered at all, and if so whether the answer is NODATA or a real address.
2. What sits in front of glibc there. Both `systemd-resolved` and `nscd` cache negative answers, so one bad lookup can keep every later step failing with FTL doing nothing wrong.

On the Pi-hole side, the query log filtered for `rasp0` over that window says directly what FTL sent back.

**Comment by mapi68** [comment]
@DL6ER Ran the `tcpdump` on the deploy machine, and the query log filter, here's what confirms it.

**`nsswitch.conf` on the deploy machine** (no `systemd-resolved`/`nscd` in front of glibc):
```
hosts:          files myhostname dns
```

**`tcpdump -i any -n port 53` during a successful run (v6.6.2):**
```
11:01:03.456775 eth0  Out IP 172.19.43.99.40605 > 172.19.32.1.53: 58416+ A? rasp0. (23)
11:01:03.456785 eth0  Out IP 172.19.43.99.40605 > 172.19.32.1.53: 1843+ AAAA? rasp0. (23)
11:01:03.463517 eth0  In  IP 172.19.32.1.53 > 172.19.43.99.40605: 58416- 1/0/0 A 192.168.1.200 (44)
11:01:03.468298 eth0  In  IP 172.19.32.1.53 > 172.19.43.99.40605: 1843- 1/0/0 AAAA fe80::7e3d:563b:32a1:13c1 (56)
```
FTL answers both A and AAAA with a real address (`1/0/0`).

**Same capture during a failed run (`development`):**
```
10:58:38.282241 eth0  Out IP 172.19.43.99.52392 > 172.19.32.1.53: 61301+ A? rasp0. (23)
10:58:38.282251 eth0  Out IP 172.19.43.99.52392 > 172.19.32.1.53: 61960+ AAAA? rasp0. (23)
10:58:38.292565 eth0  In  IP 172.19.32.1.53 > 172.19.43.99.52392: 61301 0/0/0 (23)
10:58:38.298011 eth0  In  IP 172.19.32.1.53 > 172.19.43.99.52392: 61960 0/0/0 (23)
```
FTL answers immediately (no delay), but with `0/0/0`, NOERROR with an empty payload. That's exactly the NODATA you were expecting, not a stall: the client gets a fast, valid-looking but empty response, and since nothing caches it locally (no resolved/nscd), every later `ssh` call in that same deploy run re-queries and gets the same empty answer until whatever condition on the FTL side clears.

So this confirms your read: it's FTL returning NODATA for `rasp0` under the burst, not a dead resolver thread or a stuck client. I'll pull the Pi-hole-side query log for that same window next to see what FTL logged internally for those queries.

**Comment by DL6ER** [comment]
That 23-byte `NOERROR` `0/0/0` with no SOA is a locally-generated empty reply. On v6.7 two causes give a byte-identical packet: the name blocked with `dns.blocking.mode = NODATA`, or the name known locally with no A/AAAA to give. Your capture rules out truncation (`tc` would be set) and an upstream NODATA (SOA, 91-95 bytes), but cannot separate those two.

To settle it:

1. `dig rasp0 @<your-pihole>` from that client - dig sends EDNS, so a blocked answer carries `EDE 15 (Blocked)`.
2. Right after reproducing: `grep rasp0 /var/log/pihole/pihole.log | tail -20`. Blocking logs `exactly denied rasp0 is NODATA`, an empty local record logs `config rasp0 is NODATA`.
3. Then `pihole -d`, answer yes when it offers to upload, and post the token. It is not public - only the members of https://github.com/orgs/pi-hole/teams/debug can read it. It gives me the config, `dnsmasq.conf`, `/etc/hosts` and interface addresses.

Keep 2 separate - `pihole -d` only tails the log, so those lines may already be gone.

If it is the local-record case: how is `rasp0` defined? A LAN IPv4 plus a link-local IPv6 on one name looks like interface-address substitution, not a static entry.

**Comment by mapi68** [comment]
@DL6ER Confirms your second hypothesis, not the blocking one.

**1. `dig` with EDNS, same client, both versions:**

v6.6.2:
```
;; ->>HEADER<<- opcode: QUERY, status: NOERROR, id: 54479
;; flags: qr aa rd ra; QUERY: 1, ANSWER: 1, AUTHORITY: 0, ADDITIONAL: 1
; EDE: 29: (synthesized)
;; ANSWER SECTION:
rasp0.                  0       IN      A       192.168.1.100
```

v6.7:
```
;; ->>HEADER<<- opcode: QUERY, status: NOERROR, id: 22743
;; flags: qr rd ra; QUERY: 1, ANSWER: 0, AUTHORITY: 0, ADDITIONAL: 1
; EDE: 29: (synthesized)
```

No `EDE 15 (Blocked)` on either side, both show `EDE 29 (synthesized)`, so it's not blocking. One more thing worth noting: v6.6.2 answers with the `aa` (authoritative) flag set and a real address, v6.7 drops `aa` and returns nothing.

**2. How `rasp0` is defined:** just as you suspected. There's no static DNS record in Pi-hole (`/etc/pihole/*.conf` and `/etc/dnsmasq.d/*.conf` both empty for `rasp0`). The only place it appears is `/etc/hosts` on the Pi-hole host itself:
```
127.0.1.1       rasp0
```
That's Debian/Raspbian's standard auto-generated loopback entry for the machine's own hostname, not a LAN-facing record. So it looks like v6.7 is now picking this up and synthesizing from it (a loopback address, not usable), where `6.6.2` resolved `rasp0` some other way (dynamically, via the client table reverse-lookup we saw earlier) and returned the real LAN address instead.

**3. Debug token:** https://tricorder.pi-hole.net/TU493jNX/

**4. `pihole.log` grep, right after reproducing:**

v6.6.2 (working):
```
Sep  1 18:52:04 dnsmasq[10467]: query[A] rasp0 from 192.168.1.68
Sep  1 18:52:04 dnsmasq[10467]: Pi-hole hostname rasp0 is 192.168.1.100
Sep  1 18:52:04 dnsmasq[10467]: query[AAAA] rasp0 from 192.168.1.68
Sep  1 18:52:04 dnsmasq[10467]: Pi-hole hostname rasp0 is fe80::7e3d:563b:32a1:13c1
```

v6.7 (failing):
```
Sep  1 18:41:33 dnsmasq[8542]: query[A] rasp0 from 192.168.1.68
Sep  1 18:41:33 dnsmasq[8542]: Pi-hole hostname rasp0 is NODATA
Sep  1 18:41:33 dnsmasq[8542]: query[AAAA] rasp0 from 192.168.1.68
Sep  1 18:41:33 dnsmasq[8542]: Pi-hole hostname rasp0 is NODATA
```

Same exact log line, `Pi-hole hostname rasp0 is ...`, on both versions, so it's the same code path, not a different one. On v6.6.2 it fills in the real LAN address and the link-local IPv6, on v6.7 it resolves to NODATA instead. Neither matches the two strings you listed (`denied` / `config`), this looks like a dedicated path that treats `rasp0` as Pi-hole's own hostname (consistent with the `/etc/hosts` loopback entry from #2), and something changed in how it resolves that name between the two versions.

**Comment by DL6ER** [comment]
Your log grep settles the path: `Pi-hole hostname rasp0 is ...` appears on both versions, so the same code handles it in each. Only what it finds changed.

One correction though - this is not FTL picking up the `127.0.1.1` line from `/etc/hosts`. That path never reads `/etc/hosts`; it answers `pi.hole` and the local host name from the address of the interface the query arrived on. If the loopback entry were the source you would be getting `127.0.0.1`, not NODATA.

What points at the real cause is that A and AAAA fail *together*. On 6.6.2 both resolve, eth0's `192.168.1.100` and its link-local; on 6.7 both are empty. Per-family address selection going wrong would break one family and spare the other. Both emptying at once means the whole interface record is being invalidated.

That fits an interface cache added after 6.6.2. When FTL cannot determine which interface a query arrived on it clears the cached addresses but leaves the cache pointing at the interface it resolved last, so the next query on that interface matches the cache, returns early and reuses the cleared state. Every query of yours arrives on eth0, so nothing forces a recompute and it stays that way until a restart.

You can check that without a new build. While `rasp0` is failing from the LAN, run this on the Pi-hole itself:

```
dig rasp0 @127.0.0.1
```

That one arrives on `lo` and evicts the stale entry. If the LAN client gets an answer right after, this is it.

The fix is on `fix/iface-cache-stale-nodata`, branched off v6.7 so it is your current version plus one commit:

```
pihole checkout ftl fix/iface-cache-stale-nodata
```

`pihole checkout ftl master` puts you back on the release.

**Comment by mapi68** [comment]
@DL6ER Confirmed, your test nails it exactly.

While `rasp0` was failing from the LAN, ran on the Pi-hole itself:
```
dig rasp0 @127.0.0.1
;; ->>HEADER<<- opcode: QUERY, status: NOERROR, id: 24677
;; flags: qr aa rd ra; QUERY: 1, ANSWER: 1, AUTHORITY: 0, ADDITIONAL: 1
; EDE: 29: (synthesized)
;; ANSWER SECTION:
rasp0.                  0       IN      A       127.0.0.1
```

Then immediately from the LAN client:
```
dig rasp0 @192.168.1.100
;; ->>HEADER<<- opcode: QUERY, status: NOERROR, id: 21539
;; flags: qr aa rd ra; QUERY: 1, ANSWER: 1, AUTHORITY: 0, ADDITIONAL: 1
; EDE: 29: (synthesized)
;; ANSWER SECTION:
rasp0.                  0       IN      A       192.168.1.100
```

The `lo` query evicted the stale entry and the LAN query resolved correctly right after, back to a real answer instead of NODATA. Matches your explanation exactly.

One thing to flag: `pihole checkout ftl fix/iface-cache-stale-nodata` still isn't fetching a binary, and it's been failing since yesterday, not just a slow CI queue. Checked the branch's GitHub Actions run and the build itself is failing:

```
BATS TEST FAILURE DEBUG
═══════════════════════════════════════════════════════════════════════════════
 TEST DESCRIPTION:
 FTL terminates with message
 COMMAND EXECUTED:
 bash -c ./pihole-FTL wait-for '########## FTL terminated after' /var/log/pihole/FTL.log 30 5707593
 OUTPUT CAPTURED:
 Did not find string "########## FTL terminated after" in file /var/log/pihole/FTL.log within 30 seconds
```

So the arm64 binary was never published for that branch, that's why `pihole checkout ftl` keeps refusing it. Let me know once the test/build is fixed and I'll pull the branch to confirm the actual patch, but the manual `lo`/`eth0` test above already lines up with your diagnosis.

**Comment by DL6ER** [comment]
Confirmed - thanks for running that. The `lo` query evicting the stale entry and the LAN query answering correctly right after is the interface cache, so that is the cause.

The build failure was in the test environment rather than in the fix, and is already fixed upstream. I have rebased the branch onto `development`, so

```
sudo pihole checkout ftl fix/iface-cache-stale-nodata
```

should fetch a binary once CI finishes.

Two things to know before you run it: `development` carries breaking changes to logging, and DoT/DoH are already available there. So it is not a like-for-like comparison against v6.7 - good for confirming the fix, not something to leave running if you want best stability. You can leave it running, of course, if you want, though. Otherwise `sudo pihole checkout ftl master` reverts it to the last stable release.

**edit**: The CI build is now fully complete, the binary is available

**Comment by mapi68** [comment]
@DL6ER Confirmed, the fix works.

Ran `sudo pihole checkout ftl fix/iface-cache-stale-nodata`, reproduced the same SSH/rsync burst that reliably triggered the freeze on both v6.7 and `development` before, and this time `rasp0` kept resolving correctly throughout, no NODATA, no failed deploy steps.

Thanks for tracking this down, appreciate the thorough back-and-forth. Happy to leave this branch running for a bit longer if further testing would help, otherwise I'll revert to `master` once it lands in a release. Let me know if there's anything else useful to check in the meantime.

Feel free to close this out as resolved.

**Comment by DL6ER** [comment]
Thank you for testing! We'll keep this open until the next release is out so other users can find it

**Comment by DL6ER** [comment]
FTL v6.7.1 has been released and includes this fix. Please update. If you switched to a bugfix branch in the meantime, `sudo pihole checkout ftl master` gets you back on the release. Should the problem persist after updating, please open a new issue and reference this one.
